{
  "$schema": "https://json-schema.org/draft/2020-12/schema",
  "$id": "emergentism/PQAQuestionTrial.v1",
  "title": "PQAQuestionTrial.v1",
  "type": "object",
  "required": ["schema_id", "benchmark_id", "protocol_version", "trial_id", "question_id", "synthetic", "phases", "native_target", "assumptions", "typed_propositions", "rivals", "effect_kind", "residual_state", "result_state", "residual_debt", "type_dissolution", "normative_bridge", "predictions", "revision_ledger", "transfer_answer"],
  "properties": {
    "schema_id": {"const": "PQAQuestionTrial.v1"},
    "benchmark_id": {"const": "PQA-54"},
    "protocol_version": {"const": "0.1.0"},
    "trial_id": {"type": "string", "minLength": 1},
    "question_id": {"type": "string", "pattern": "^PQA54@0\\.1:"},
    "synthetic": {"type": "boolean"},
    "phases": {"type": "array", "minItems": 5, "maxItems": 5},
    "native_target": {"type": "string", "minLength": 1},
    "assumptions": {"type": "array"},
    "typed_propositions": {"type": "array", "minItems": 1},
    "rivals": {"type": "array", "minItems": 2},
    "effect_kind": {"enum": ["NO_INCREMENT", "CLARIFICATION", "FORMAL_CORRECTION", "TYPE_DISSOLUTION", "CONDITIONAL_RESOLUTION", "PRACTICAL_GUIDANCE", "REFUTATION"]},
    "residual_state": {"enum": ["NONE", "PARTIAL", "OPEN", "UNDERDETERMINED"]},
    "result_state": {"enum": ["UNRUN", "MACHINE_VALIDATED", "NATIVE_REVIEW_PENDING", "EARNED", "KILLED", "RETRACTED"]},
    "residual_debt": {"type": "array"},
    "type_dissolution": {"type": ["object", "null"]},
    "normative_bridge": {"type": ["object", "null"]},
    "predictions": {"type": "array"},
    "revision_ledger": {"type": "array", "minItems": 1},
    "transfer_answer": {"type": "object"}
  },
  "additionalProperties": false
}
